{
  "id": "sour-gummy",
  "name": "酸酸软糖",
  "version": 1,
  "family": "gummy",
  "rarity": "common",
  "tags": ["fast", "sour"],
  "description": "小而快的黄色酸味软糖，会打乱守护员走位。",
  "stats": {
    "health": 12,
    "move_speed": 92,
    "contact_damage_per_second": 3.5,
    "radius": 11,
    "xp_value": 3,
    "score_value": 8
  },
  "behavior": {
    "type": "chase",
    "parameters": {}
  },
  "spawn_budget": {
    "threat": 1.4,
    "performance_cost": 1.0
  },
  "counterplay": "提前拉开距离，避免被快速贴身。",
  "visual_description": "黄色软糖表面撒满酸粒，轮廓有小尖角。",
  "death_effect": "爆成亮黄色酸糖粉。",
  "sfx_description": "短促的 sour pop 声。"
}
